{
  "generated_at": "2026-08-16T23:31:01.351180Z",
  "input_checksums": {
    "data": "19ca23c02ff86dd1f7c78018e4052eea98de4ecca879f467c3a9d57f55b38d2c",
    "macro_data": "475958128c45301a083d720589d065e19a15b4915396066046fca630f2577d41",
    "request": "e8fededf889e7639d6e8b4da691e75c85a9155e1654fb2e2dd4ae242cb8b8385",
    "research_plan": "e123c42023862cf45dc1d3d844e0468f5aa34cba260f2451c09884cb472d0e02",
    "shock_artifact": "c09790750092a31621fbef0db46dad53636c2a38eefa32536c050d62bb30a325"
  },
  "output_checksums": {
    "diagnostics.json": "495392aa4f2c7c69158d6401c2aa9ec28685ac5b9be4dc41708c6ccd09d37c1d",
    "dynamic-path.csv": "56bc46ede95880b512ea6de417dfdbe6b88dba742fb9be3add3db7f2c984be81",
    "dynamic-path.png": "7d69fdd47e770488b88045de5809b40bd9a26069adcaa666e67c07678da5204d",
    "plain-language-summary.md": "66f6c31a630f91a138e124cfe207bb91775cef4b0ed14ad9a56ecbe20f6da0a5",
    "request.json": "e8fededf889e7639d6e8b4da691e75c85a9155e1654fb2e2dd4ae242cb8b8385",
    "result.json": "0b2094b0d77d3132e650446e68d8a074516dc16dfc80257f4f03d7b9d7ed0fb9",
    "technical-summary.md": "7d40b957a1e7002655c0142e103f7afdc9fa9a14cf0ae7df5f7c407ec84df677"
  },
  "request_id": "tsd-request-ceb642a657cd2fdbd53606433880f7b9",
  "run_id": "tsd-run-bc7048eaa35fab85fa48bacb1c6bcced",
  "runtime": {
    "numpy": "2.3.5",
    "pandas": "2.3.3",
    "python": "3.12.13",
    "statsmodels": "0.14.6"
  },
  "schema_version": "0.1.0",
  "secrets_recorded": false
}
