{
  "generated_at": "2026-08-16T23:30:47.304944Z",
  "input_checksums": {
    "data": "19ca23c02ff86dd1f7c78018e4052eea98de4ecca879f467c3a9d57f55b38d2c",
    "macro_data": "b28454c960a25c8290040713956b72ec3cb13d8c1799d3c4e0e6e24065c6734a",
    "request": "4b9d235c2f97f8de008ea6ad073094fcf1718c127ae4f44eeb9572a597eec10e",
    "research_plan": "e123c42023862cf45dc1d3d844e0468f5aa34cba260f2451c09884cb472d0e02",
    "shock_artifact": "c09790750092a31621fbef0db46dad53636c2a38eefa32536c050d62bb30a325"
  },
  "output_checksums": {
    "diagnostics.json": "b7a8d84a87cedae73c05ed7dac3b38b5189774ca509a2b163c2da3b678ef01b2",
    "dynamic-path.csv": "6ee7b623bfdf11989411395200d450e78505d081bf7ff713b11fec71ccbb2fa6",
    "dynamic-path.png": "3a97d1cc63748f4b2914de359fe226fb12cc2ae11dc74bd43777500220c9456d",
    "plain-language-summary.md": "d7c3db0768e74cf2bc889fedcc0eb2a8cbb2984780c4493a2d1bd5b29c47bb55",
    "request.json": "4b9d235c2f97f8de008ea6ad073094fcf1718c127ae4f44eeb9572a597eec10e",
    "result.json": "ecda42b4adff8bf0262d363ddbb6c4119d1290c2531eb8966bbadeeaa059cea7",
    "technical-summary.md": "5c967b1129a8a8221ec421c004809523b059ace611366b698954c910701fe062"
  },
  "request_id": "tsd-request-d520ffb46adc8874ef66966e28441c52",
  "run_id": "tsd-run-a30d0513d8639b04abb0b3795bee526c",
  "runtime": {
    "numpy": "2.3.5",
    "pandas": "2.3.3",
    "python": "3.12.13",
    "statsmodels": "0.14.6"
  },
  "schema_version": "0.1.0",
  "secrets_recorded": false
}
