{
  "generated_at": "2026-08-16T23:30:57.882344Z",
  "input_checksums": {
    "data": "19ca23c02ff86dd1f7c78018e4052eea98de4ecca879f467c3a9d57f55b38d2c",
    "macro_data": "54721abe11bfd47fbd55e8cf33bfd6ccf27e86e9eb38c66e9effad677c5bdc9e",
    "request": "3365d6bf243ea3c9912ca4d06c181a1e3319f49a4142d8ddcf92ee396ac721c0",
    "research_plan": "e123c42023862cf45dc1d3d844e0468f5aa34cba260f2451c09884cb472d0e02",
    "shock_artifact": "c09790750092a31621fbef0db46dad53636c2a38eefa32536c050d62bb30a325"
  },
  "output_checksums": {
    "diagnostics.json": "56f1c0f4e2e1c239dfc580cbf90fe4655fd12b01075e48a94ac76db1c350f1cb",
    "dynamic-path.csv": "5808e3c96bbff76d1047e973237cf9bb3ecd0834f4686683891933d68a0b1356",
    "dynamic-path.png": "88f5759bbb643cd9ce76a358df89929c79a632648a6be6c1b83037ddb9384a34",
    "plain-language-summary.md": "f6b84a5cb403046036c483a60a15d03771c3aa59a2da983aaa8d821a8bfc5fdb",
    "request.json": "3365d6bf243ea3c9912ca4d06c181a1e3319f49a4142d8ddcf92ee396ac721c0",
    "result.json": "893f089d117851900abbc80d28d460aa8c707ea8275a9d18b9f66383211179a8",
    "technical-summary.md": "8cef2ea465da247816e47a2cf3217165d501316ea65e42ecc3b2a20747406a8e"
  },
  "request_id": "tsd-request-4ac79a1a6ebcf54b54441e27454cef89",
  "run_id": "tsd-run-36ba47f8a79fe2a36dc95c454a015427",
  "runtime": {
    "numpy": "2.3.5",
    "pandas": "2.3.3",
    "python": "3.12.13",
    "statsmodels": "0.14.6"
  },
  "schema_version": "0.1.0",
  "secrets_recorded": false
}
