{
  "generated_at": "2026-08-16T23:30:50.773841Z",
  "input_checksums": {
    "data": "19ca23c02ff86dd1f7c78018e4052eea98de4ecca879f467c3a9d57f55b38d2c",
    "macro_data": "b28454c960a25c8290040713956b72ec3cb13d8c1799d3c4e0e6e24065c6734a",
    "request": "1289e7244ef74f87073470983ecfa5afeeb583104ff5a7f5829b877f015917a9",
    "research_plan": "e123c42023862cf45dc1d3d844e0468f5aa34cba260f2451c09884cb472d0e02",
    "shock_artifact": "c09790750092a31621fbef0db46dad53636c2a38eefa32536c050d62bb30a325"
  },
  "output_checksums": {
    "diagnostics.json": "b936cedfaca4cb1dd7099cbd897f83fe08c10ca5014dff01d6732ff6f3e27681",
    "dynamic-path.csv": "9b03e648d217647724a644dfcb3d3ec787b3d1edbdfef7442eba9c7b6c0fce8a",
    "dynamic-path.png": "535da8956c164039ffaac25a90300c35e179b82cddb11dabb9f436bff8f9d9fe",
    "plain-language-summary.md": "e0482f978af5cdc9219d677cef65878920aad21a5b6c99c581496527fc379401",
    "request.json": "1289e7244ef74f87073470983ecfa5afeeb583104ff5a7f5829b877f015917a9",
    "result.json": "6728a6368e234408ad8e6088c46cc080aaace61ac06711ec1dd339ff84581ba2",
    "technical-summary.md": "75ad76951437dda2d8c257fd1ede209b6a24d5bd7e296639620659e6f63119dd"
  },
  "request_id": "tsd-request-43e0051a2f5b919d8317bfb8649c4e88",
  "run_id": "tsd-run-e21408a2ed309ac95112d7f78ec3a98f",
  "runtime": {
    "numpy": "2.3.5",
    "pandas": "2.3.3",
    "python": "3.12.13",
    "statsmodels": "0.14.6"
  },
  "schema_version": "0.1.0",
  "secrets_recorded": false
}
