{
  "generated_at": "2026-08-16T23:30:54.100253Z",
  "input_checksums": {
    "data": "19ca23c02ff86dd1f7c78018e4052eea98de4ecca879f467c3a9d57f55b38d2c",
    "macro_data": "b28454c960a25c8290040713956b72ec3cb13d8c1799d3c4e0e6e24065c6734a",
    "request": "3833967042f01564887677bd5b46f830718c0fb600fe3936da49f36b9ec467fd",
    "research_plan": "e123c42023862cf45dc1d3d844e0468f5aa34cba260f2451c09884cb472d0e02",
    "shock_artifact": "c09790750092a31621fbef0db46dad53636c2a38eefa32536c050d62bb30a325"
  },
  "output_checksums": {
    "diagnostics.json": "ad8a3db21382bb1ead0f05ef16caaa10833dcdfa3b65a03589dcb1dbc740e5d9",
    "dynamic-path.csv": "f316794498b5e9eecb5545711acdd44530205821667451323c5caebd3bca01a6",
    "dynamic-path.png": "b75371c76f2f6ad71509399a7a8282f12fbcd8e83833e6234fb5643901a5e394",
    "plain-language-summary.md": "054f3720bf1001ae805f19c09a392f63246aacc798fe983b14f7c97cd7e9dd41",
    "request.json": "3833967042f01564887677bd5b46f830718c0fb600fe3936da49f36b9ec467fd",
    "result.json": "285bbdae3a1b5bd7e42034dc8ffcb8cf7b72b6004f4cf47059d194a36e5591b6",
    "technical-summary.md": "543a82aeb8617879560d252c9be1fb91c03ca068c20eb855c430a04d354673b1"
  },
  "request_id": "tsd-request-3a0e72ad4d76d2df661f8835ccea7b8e",
  "run_id": "tsd-run-824a17b5659113aaacafd2992cf79121",
  "runtime": {
    "numpy": "2.3.5",
    "pandas": "2.3.3",
    "python": "3.12.13",
    "statsmodels": "0.14.6"
  },
  "schema_version": "0.1.0",
  "secrets_recorded": false
}
